{
  "schema_version": "lab.experiment_run.v1",
  "run_id": "LAB-RUN-001",
  "matrix_id": "MATRIX-001",
  "target_id": "pi4-target55",
  "dry_run": true,
  "trials": [
    {
      "trial_id": "TRIAL-001",
      "factors": {
        "governor": "performance"
      },
      "status": "planned",
      "artifact_refs": [],
      "failure": null,
      "started_at_unix_ms": null,
      "ended_at_unix_ms": null
    }
  ],
  "time_unix_ms": 1780000000000
}
